{
  "claim_boundary": "Typed joins among research artifacts and pinned evidence only; not an official EUDIW/FCAF graph, not conformance, and not independent reproduction.",
  "edges": [
    {
      "from": "profile:rp_verifier_assurance_0.1",
      "id": "edge:001:contains",
      "scope": "The research profile contains this rule.",
      "to": "rule:R_PARSE_INVALID",
      "type": "contains"
    },
    {
      "from": "rule:R_PARSE_INVALID",
      "id": "edge:002:operationalized_by",
      "scope": "One candidate objective translates this research rule; it does not make the rule official.",
      "to": "objective:RP_WS_MS_PresentationSyntax_001",
      "type": "operationalized_by"
    },
    {
      "from": "rule:R_PARSE_INVALID",
      "id": "edge:003:anchored_in",
      "scope": "The research rule cites this normative or documentary anchor.",
      "to": "source:OpenID4VP-1.0",
      "type": "anchored_in"
    },
    {
      "from": "rule:R_PARSE_INVALID",
      "id": "edge:004:anchored_in",
      "scope": "The research rule cites this normative or documentary anchor.",
      "to": "source:ARF-3.0.0",
      "type": "anchored_in"
    },
    {
      "from": "profile:rp_verifier_assurance_0.1",
      "id": "edge:005:contains",
      "scope": "The research profile contains this rule.",
      "to": "rule:R_RP_UNREGISTERED",
      "type": "contains"
    },
    {
      "from": "rule:R_RP_UNREGISTERED",
      "id": "edge:006:operationalized_by",
      "scope": "One candidate objective translates this research rule; it does not make the rule official.",
      "to": "objective:RP_WS_SM_Registration_001",
      "type": "operationalized_by"
    },
    {
      "from": "rule:R_RP_UNREGISTERED",
      "id": "edge:007:anchored_in",
      "scope": "The research rule cites this normative or documentary anchor.",
      "to": "source:eIDAS-Art-5b",
      "type": "anchored_in"
    },
    {
      "from": "rule:R_RP_UNREGISTERED",
      "id": "edge:008:anchored_in",
      "scope": "The research rule cites this normative or documentary anchor.",
      "to": "source:CIR-2025-848",
      "type": "anchored_in"
    },
    {
      "from": "profile:rp_verifier_assurance_0.1",
      "id": "edge:009:contains",
      "scope": "The research profile contains this rule.",
      "to": "rule:R_RP_SUSPENDED",
      "type": "contains"
    },
    {
      "from": "rule:R_RP_SUSPENDED",
      "id": "edge:010:operationalized_by",
      "scope": "One candidate objective translates this research rule; it does not make the rule official.",
      "to": "objective:RP_WS_SM_RegistrationStatus_001",
      "type": "operationalized_by"
    },
    {
      "from": "rule:R_RP_SUSPENDED",
      "id": "edge:011:anchored_in",
      "scope": "The research rule cites this normative or documentary anchor.",
      "to": "source:CIR-2025-848",
      "type": "anchored_in"
    },
    {
      "from": "profile:rp_verifier_assurance_0.1",
      "id": "edge:012:contains",
      "scope": "The research profile contains this rule.",
      "to": "rule:R_RP_IDENTITY_MISMATCH",
      "type": "contains"
    },
    {
      "from": "rule:R_RP_IDENTITY_MISMATCH",
      "id": "edge:013:operationalized_by",
      "scope": "One candidate objective translates this research rule; it does not make the rule official.",
      "to": "objective:RP_WS_SM_RegistrationIdentity_001",
      "type": "operationalized_by"
    },
    {
      "from": "rule:R_RP_IDENTITY_MISMATCH",
      "id": "edge:014:anchored_in",
      "scope": "The research rule cites this normative or documentary anchor.",
      "to": "source:eIDAS-Art-5b",
      "type": "anchored_in"
    },
    {
      "from": "rule:R_RP_IDENTITY_MISMATCH",
      "id": "edge:015:anchored_in",
      "scope": "The research rule cites this normative or documentary anchor.",
      "to": "source:ETSI-TS-119-475",
      "type": "anchored_in"
    },
    {
      "from": "profile:rp_verifier_assurance_0.1",
      "id": "edge:016:contains",
      "scope": "The research profile contains this rule.",
      "to": "rule:R_PURPOSE_MISMATCH",
      "type": "contains"
    },
    {
      "from": "rule:R_PURPOSE_MISMATCH",
      "id": "edge:017:operationalized_by",
      "scope": "One candidate objective translates this research rule; it does not make the rule official.",
      "to": "objective:RP_WS_IA_IntendedUse_001",
      "type": "operationalized_by"
    },
    {
      "from": "rule:R_PURPOSE_MISMATCH",
      "id": "edge:018:anchored_in",
      "scope": "The research rule cites this normative or documentary anchor.",
      "to": "source:eIDAS-Art-5b",
      "type": "anchored_in"
    },
    {
      "from": "rule:R_PURPOSE_MISMATCH",
      "id": "edge:019:anchored_in",
      "scope": "The research rule cites this normative or documentary anchor.",
      "to": "source:ETSI-TS-119-475",
      "type": "anchored_in"
    },
    {
      "from": "rule:R_PURPOSE_MISMATCH",
      "id": "edge:020:anchored_in",
      "scope": "The research rule cites this normative or documentary anchor.",
      "to": "source:CIR-2024-2981-TR40",
      "type": "anchored_in"
    },
    {
      "from": "profile:rp_verifier_assurance_0.1",
      "id": "edge:021:contains",
      "scope": "The research profile contains this rule.",
      "to": "rule:R_ATTRIBUTE_OVER_REQUEST",
      "type": "contains"
    },
    {
      "from": "rule:R_ATTRIBUTE_OVER_REQUEST",
      "id": "edge:022:operationalized_by",
      "scope": "One candidate objective translates this research rule; it does not make the rule official.",
      "to": "objective:RP_WS_IA_AttributeRequest_001",
      "type": "operationalized_by"
    },
    {
      "from": "rule:R_ATTRIBUTE_OVER_REQUEST",
      "id": "edge:023:anchored_in",
      "scope": "The research rule cites this normative or documentary anchor.",
      "to": "source:eIDAS-Art-5b",
      "type": "anchored_in"
    },
    {
      "from": "rule:R_ATTRIBUTE_OVER_REQUEST",
      "id": "edge:024:anchored_in",
      "scope": "The research rule cites this normative or documentary anchor.",
      "to": "source:ETSI-TS-119-475",
      "type": "anchored_in"
    },
    {
      "from": "rule:R_ATTRIBUTE_OVER_REQUEST",
      "id": "edge:025:anchored_in",
      "scope": "The research rule cites this normative or documentary anchor.",
      "to": "source:CIR-2024-2981-TR90",
      "type": "anchored_in"
    },
    {
      "from": "profile:rp_verifier_assurance_0.1",
      "id": "edge:026:contains",
      "scope": "The research profile contains this rule.",
      "to": "rule:R_ISSUER_SIGNATURE_INVALID",
      "type": "contains"
    },
    {
      "from": "rule:R_ISSUER_SIGNATURE_INVALID",
      "id": "edge:027:operationalized_by",
      "scope": "One candidate objective translates this research rule; it does not make the rule official.",
      "to": "objective:RP_WS_SM_IssuerAuthentication_001",
      "type": "operationalized_by"
    },
    {
      "from": "rule:R_ISSUER_SIGNATURE_INVALID",
      "id": "edge:028:anchored_in",
      "scope": "The research rule cites this normative or documentary anchor.",
      "to": "source:ARF-3.0.0",
      "type": "anchored_in"
    },
    {
      "from": "rule:R_ISSUER_SIGNATURE_INVALID",
      "id": "edge:029:anchored_in",
      "scope": "The research rule cites this normative or documentary anchor.",
      "to": "source:OpenID4VP-1.0",
      "type": "anchored_in"
    },
    {
      "from": "profile:rp_verifier_assurance_0.1",
      "id": "edge:030:contains",
      "scope": "The research profile contains this rule.",
      "to": "rule:R_DISCLOSURE_UNBOUND",
      "type": "contains"
    },
    {
      "from": "rule:R_DISCLOSURE_UNBOUND",
      "id": "edge:031:operationalized_by",
      "scope": "One candidate objective translates this research rule; it does not make the rule official.",
      "to": "objective:RP_WS_SM_DisclosureBinding_001",
      "type": "operationalized_by"
    },
    {
      "from": "rule:R_DISCLOSURE_UNBOUND",
      "id": "edge:032:anchored_in",
      "scope": "The research rule cites this normative or documentary anchor.",
      "to": "source:RFC-9901",
      "type": "anchored_in"
    },
    {
      "from": "rule:R_DISCLOSURE_UNBOUND",
      "id": "edge:033:anchored_in",
      "scope": "The research rule cites this normative or documentary anchor.",
      "to": "source:ARF-3.0.0",
      "type": "anchored_in"
    },
    {
      "from": "profile:rp_verifier_assurance_0.1",
      "id": "edge:034:contains",
      "scope": "The research profile contains this rule.",
      "to": "rule:R_HOLDER_BINDING_INVALID",
      "type": "contains"
    },
    {
      "from": "rule:R_HOLDER_BINDING_INVALID",
      "id": "edge:035:operationalized_by",
      "scope": "One candidate objective translates this research rule; it does not make the rule official.",
      "to": "objective:RP_WS_SM_HolderBinding_001",
      "type": "operationalized_by"
    },
    {
      "from": "rule:R_HOLDER_BINDING_INVALID",
      "id": "edge:036:anchored_in",
      "scope": "The research rule cites this normative or documentary anchor.",
      "to": "source:ARF-3.0.0",
      "type": "anchored_in"
    },
    {
      "from": "rule:R_HOLDER_BINDING_INVALID",
      "id": "edge:037:anchored_in",
      "scope": "The research rule cites this normative or documentary anchor.",
      "to": "source:OpenID4VP-1.0",
      "type": "anchored_in"
    },
    {
      "from": "profile:rp_verifier_assurance_0.1",
      "id": "edge:038:contains",
      "scope": "The research profile contains this rule.",
      "to": "rule:R_AUDIENCE_MISMATCH",
      "type": "contains"
    },
    {
      "from": "rule:R_AUDIENCE_MISMATCH",
      "id": "edge:039:operationalized_by",
      "scope": "One candidate objective translates this research rule; it does not make the rule official.",
      "to": "objective:RP_WS_SM_AudienceBinding_001",
      "type": "operationalized_by"
    },
    {
      "from": "rule:R_AUDIENCE_MISMATCH",
      "id": "edge:040:anchored_in",